{
  "job_id": "finance-doc-sample-001",
  "created_at": "2026-04-23T08:30:00Z",
  "source": "google_drive",
  "drive_file_id": "sample-drive-file-id",
  "drive_file_name": "sample-receipt.txt",
  "drive_file_url": "https://drive.google.com/file/d/sample-drive-file-id/view",
  "mime_type": "text/plain",
  "extracted_text_path": "/home/dank/Projects/holden-capital-agentic-workflows/samples/sample-receipt-text.txt",
  "output_path": "/home/dank/Projects/holden-capital-agentic-workflows/runtime/finance-document-intake/outputs/finance-doc-sample-001.json",
  "schema_version": "1.0"
}
